id_calon,riwayat_organisasi,
3303-00-0000-0701,Anggota KAGAMA (Keluarga Alumni Univerrsitas Gajah Mada),
3303-00-0000-0701,Penasehat Ikatan Alumni Teknologi Pertania Universitas Gajah Mada,
3303-00-0000-0701,Ketua HKTI ( Himpunan Kerukunan Tani Indonesia ),
3303-00-0000-0401,Wakil ketua Umum INCCA 2007-2009,
3303-00-0000-0401,KETUA Bis - Dana INCCA 2001-2006,
3303-00-0000-0401,Kainor Dagang & Industh Indonesia (KADIM) 2005-200,
3303-00-0000-0402,Persatuan Wartawan Indonesia (PWI) Wilayah Jawa Tengah,
3303-00-0000-0402,Perbakin Wilayah Jawa Tengah,
3303-00-0000-0402,Koni Kabupaten Pati,
3304-00-0000-0503,"2006-2013, APPS(ALIANSI PEDULI PEREMPUAN SUKSES), KETUA UMUM, WONOGIRI",
3304-00-0000-0503,"2007-2012, DEWAN RISER DAERAH (DRD), PENGURUS, WONOGIRI",
3304-00-0000-0503,"2010-2015, MASYARAKAT PEDULI PEREMPUAN ANAK (MWPPA), PENASEHAT, WONOGIRI",
3304-00-0000-0503,"2010-2015, YKUB, WAKIL KETUA, WONOGIRI",
3304-00-0000-0602,"TIDAR (Tunas Indonesia Raya-sayap Pemuda Partai Gerindra) Kepala Bidang Pengembangan Peranan Perempuan, 2008-2010, Maret 2011-sekarang",
3304-00-0000-0602,"TIDAR (Tunas Indonesia Raya-sayap Pemuda Partai Gerindra) Wakil Ketua Bidang Agama, 2010-2011",
3304-00-0000-0602,"Satria (Satuan Relawan Indonesia Raya) Wakil Ketua, 2008-2009",
3304-00-0000-0304,Wakil Ketua DPD PKS Wonogiri,
3304-00-0000-0304,MPW PKS Jawa Tengah,
3304-00-0000-0701,Ketua Harley Davidson Karesidenan Surakarta (2002-2007),
3304-00-0000-0701,Bendahara SPSI Kab. Karanganyar (2002-2007),
3304-00-0000-0701,Wakil Ketua Gapensi (2002-2007),
3304-00-0000-0701,Manager PSSIU-14 (2012-sekarang),
3304-00-0000-0701,Dewan Penasihat ATPUSI (Asosiasi Tenaga Perpustakaan Sekolah Indonesia),
3304-00-0000-0401,"GMNI, UGM",
3304-00-0000-0403,Anggota GMNI UNDIP,
3304-00-0000-0403,"Bendahara Umum Kopma Kosuma UNDIP, Semarang",
3304-00-0000-0801,"DPW PAN Jateng,Wasek BPP, 2010-2015",
3304-00-0000-0801,"DPD PAN KOTA SURAKARTA,Wakil Ketua, 2010 - 2015",
3304-00-0000-0801,"Sekar Biru (PUAN) DPC PAN Jebres, Surakarta,Wakil Ketua, 2005 - 2010",
3304-00-0000-0801,"DPD PAN Kota Surakarta., Wakil Bendahara, 2005 - 2010",
3304-00-0000-0801,"DPD PAN KOTA SURAKARTA, Wakil Ketua, 2005 - 2010",
3306-00-0000-0101,OSIS SMA Negeri 1 Magelang bidang Kerohanian Islam Alamat Jl. Cempaka 1 Kota Magelang tahun 1977-1978,
3306-00-0000-0101,HMI KORKOM FE. UII Alamat Jl.Cik D Tiro 1 Yogyakarta tahun 1981-1983,
3306-00-0000-0101,Dewan Mahasiswa/BKK-KUA/BEM UII Alamat Jl. Cik Di Tiro 1 Yogyakarta tahun 1982-1984,
3306-00-0000-0101,Aktifis Masjis Syuhada Yogyakarta Alamat Kotabaru Yogyakarta tahun 1980-1986,
3306-00-0000-0101,Pengurus Thoriqoh Mu'tabaroh wil. Jawa Tengah Alamat Semarang tahun 2005-sekarang,
3306-00-0000-0101,Pengurus Cabang Nahdlatul Ulama Kab. Magelang Alamat Mungkid Magelang tahun 2008-sekarang,
3306-00-0000-0501,"1979-1982, SLTA, SMAN TEMANGGUNG, TEMANGGUNG",
3306-00-0000-0501,"2001-2007, S3, UNDIP, SEMARANG",
3306-00-0000-0901,Ketua PH DPP PPP (2007-2012),
3306-00-0000-0901,Sekretaris PH DPPP PPP (2003-2007),
3306-00-0000-0901,Ketua Lembaga Pusat Pendidikan dan Pelatihan DPP PPP (1999-2003),
3306-00-0000-0901,Anggota Pengurus Lembaga Pusat Pendidikan dan Pelatihan DPP PP (1994-1999),
3306-00-0000-0901,Sekretaris Forum Konstitusi (2004-Sekarang),
3306-00-0000-0901,Badan Pengurus Lakpesdam NU (1996-1999),
3306-00-0000-0901,Walki Sekretaris PP-LKKN (1985-1988),
3306-00-0000-0901,Sekretaris Umum YISC Al-Azhar (1985-1988),
3306-00-0000-0901,Wakil Ketua Bidang Pengembangan Program Yayasan Saifuddin Zuhri sejak 1994-sekarang,
3306-00-0000-0201,Ketua Senat Mahasiswa Fakultas Peternakan Tahun 1994-1995,
3306-00-0000-0201,Ketua III Senat Mahasiswa Perguruan Tinggi UNDIP Semarang Tahun 1994-1995,
3306-00-0000-0201,Ketua I Koorcab PMII Jawa Tengah Tahun 1995-1996,
3306-00-0000-0201,Komite Independen Pemantau Pemilu (KIPP) Jawa Tengah Tahun 1997,
3306-00-0000-0201,Sekretaris DPW PKB Jawa Tangah Tahun 1998-2001,
3306-00-0000-0201,Wakil Ketua DPW PKB Jawa Tangah Tahun 2001-2005,
3306-00-0000-0201,Ketua DPW PKB Jawa Tengah Tahun 2006-2012,
3306-00-0000-0201,IPDA Semarang Tahun 1995-1998,
3306-00-0000-0201,Pembina PW IPNU Provinsi Jawa Tengah Tahun 2006-2009,
3306-00-0000-0201,Deputy Leadership Liberal Demokratic of Asia Tahun 2004,
3306-00-0000-0201,Pembina Koorcab PMII Provinsi Jawa Tengah Tahun 1998-Skrg,
3306-00-0000-0201,Ketua DPP IKA TUNIVERSTIAS DIPONEGORO Semarang Jateng Tahun 2010-Skrg,
3306-00-0000-0201,Pembina Persatuan Guru dan Karyawan swasta Indonesia (PGKSI) Tahun 2001-Skrg,
3306-00-0000-0201,Ketua DPP PKB Tahun 2008-Skrg,
3306-00-0000-0201,Anggota Dewan Pembina PP LPPNU Tahun 2013-2017,
3306-00-0000-0601,terlampir,
3306-00-0000-0401,Badan Pendidikan Dan Pelatihan Pusat (BADIKLATPUS) 2000 - 2003,
3306-00-0000-0401,Dewan Pertimbangan Cabang Partai Kab. Boyolali,
3306-00-0000-0401,Badan Pendidikan Pemilu Pusat (BP-Pemilu Pusat) 2008 - 2009,
3306-00-0000-0402,PNI FRONT MARHAENIS YOGYAKARTA (1960-1974)/14 TAHUN,
3306-00-0000-0402,GOLKAR SEMARANG (1982-1997)/15 TAHUN,
3306-00-0000-0402,GMNI YOGYAKARTA (1964-1969)/15 TAHUN,
3306-00-0000-0402,PERSATUAN INSINTUR INDONESIA YOGYAKARTA (1975-1985)/10 TAHUN BIRO SENI BUDAYA CENGKIA,
3306-00-0000-0402,DAN PENGASPIAN MASTARAKAT SEMARANG (1982-1997)/15 TAHUN,
3306-00-0000-0402,ORGANSASI SILAT IPG SEMARANG (1989-2005)/16 TAHUN,
3306-00-0000-0402,PERSATUAN OLANGPEPADI SEMARANG (1989-2001)/12 TAHUN,
3306-00-0000-0402,ANGGOTA DEPERDA SEMARANG (2005-2009)/4 TAHUN,
3306-00-0000-0402,PDI PERSUANTAN SUKOHARJO (2003-SKRG)/10 TAHUN,
3306-00-0000-0801,"Ikatan Alumni Keluarga Mahasiswa Islam Instut Teknologi Bandung (GAMIS ITB),",
3306-00-0000-0801,"Dewan Pimpinan Pusat Partai Amanat Nasional (DPP PAN), Jakarta, Ketua, 2010 - 2015",
3306-00-0000-0801,"Dewan Pimpinan Pusat Partai Amanat Nasional (DPP PAN), Jakarta, Bendahara, 2006 -",
3306-00-0000-0801,"Ikatan Ahli Teknik Penyehatan dan Teknik Lingkungan Se-Indonesia (IATPI),Jakarta,",
3306-00-0000-0801,"Dewan Pimpinan Pusat Partai Amanat Nasional (DPP PAN), Jakarta, Ketua, 2000 - 2005.",
3307-00-0000-0101,Bendahara Organisasi Siswa Intra Sekolah SMAN 5 Jambi (Tahun 1988) Alamat: SMAN 5 Jambi,
3307-00-0000-0101,Bendahara Organisasi Siswa Intra Sekolah SMAN 5 Jambi (Tahun 1988) Alamat: SMAN 5 Jambi,
3307-00-0000-0101,Sekretaris Persatuan Pelajar Indonesia University Kebangsaan Malaysia (Tahun 1990) Alamat: Malaysia,
3307-00-0000-0101,Wakil Sekrtaris External Garda Wanta Nasional Demokrat (Tahun 2011) Alamat: Jakarta,
3307-00-0000-0101,Bendahara Umum Gerakan Massa Buruh (GEMURUH) NasDem (Tahun 2012) Alamat: Jakarta,
3307-00-0000-0101,PLT Sekertaris Jenderal Partai NasDem (Tahun 2013) Alamat: Jakarta,
3307-00-0000-0101,Petugas Pelaksana Harian Ketua Umum Garnita Malahayati NasDem (Tahun 2013) Alamat: Jakarta,
3307-00-0000-0501,"2012-2015, KAHMI, PRESIDIUM, JAKARTA",
3307-00-0000-0501,"2009-2015, DPP GOLKAR, WAKIL BENDAHARA UMUM, JAKARTA",
3307-00-0000-0501,"2008-2013, ARDIN INDONESIA, KETUA UMUM, JAKARTA",
3307-00-0000-0901,Sekertaris Jendral DPP PPP (2011-2015),
3307-00-0000-0901,Penasehat Frata Partai Persatuan Pembangunan DPRRI (2009-Sekarang),
3307-00-0000-0901,Sekretaris Fraks Partai Persatuan Pembangunan DPRRI (2009-20011),
3307-00-0000-0901,"Wakil Sekretaris Jenderil, DPP Partai Persatuan Pembangunan (PPP) (2007-20011)",
3307-00-0000-0901,"Wakil Sekretaris, Lajansh Pemenangan Pemilu Legislatif DPP PPP (2008-2011)",
3307-00-0000-0901,"Ketua bidang Teknoligi, induk Koperasi Pondok Pesantren (Inkopontren) (2007-2012",
3307-00-0000-0901,"Anggota Dewan Pengawas, Induk Koperasi Ritel (Inkoritel)(2008-2011)",
3307-00-0000-0901,"Sekretaris, Yayasan Ma, had 'Ali Sa'idus Shiddiqyyah, Musi Banyuasin, Sumatera Setatan (2008-Sekarang",
3307-00-0000-0901,"Wakil Seretaris, Sekretaris, PP Lembaga Pengembangan Peranian Nahdiatul Ulama (LP2NU) (2005-2010)",
3307-00-0000-0901,"Ketua Divisi Pengkaderan, Lembaga Kemahasiswaan (BASIS) Masjid ITB (1994-1996)",
3307-00-0000-0901,"Pemimpin Redaksi Majalah Mahasiswa ""PILAR"", masjid Salman ITB (1995-1997)",
3307-00-0000-0901,"Ketua bid. Pengajian, Himpunan Mahasiswa Teknik Fisika ITB (1995-1996)",
3307-00-0000-0901,Ketua OSIS SMA NI Yogyakarta (1991-1992),
3307-00-0000-0901,Ketua Sie Perlengkapan OSIS SMAN 1 Yogyakarta (1990-1991),
3307-00-0000-0901,Ket ua Sie Kerohanian Ise Kerohanian Isiam OSIS SMS N 5 Yogyakarta (1987-1989),
3307-00-0000-0201,"Wakil Sekretaris Dewan Penasihat IKA PMII, 2009 - sek.",
3307-00-0000-0201,"Wakil Sekjcn PBNU, 1999 - 2004 dan 2004 - 2010",
3307-00-0000-0201,"Dewan Penyantun Paguyuban Kuda Kepang Bambu Aji Banjarnegara, 2012 - sek",
3307-00-0000-0201,"Wk. Ketua Pengurus Pondok Pesaatren At-Taqwa, Rakit, Banjamegara, 2012 - sek",
3307-00-0000-0201,"Sekretaris Yayasan Waqfiyah NU Jakarta, 2006 - set",
3307-00-0000-0201,"Wk. Sekretaris Yayasan UNU Jakarta, 2000 - 2003",
3307-00-0000-0201,"Ketua PW Lakp^sdam NU Jawa Timur, 1997 - 2000",
3307-00-0000-0201,"Sekretaris PW GP Ansor Jawa Timur, 1996 - 2000",
3307-00-0000-0201,"Ketua Lembaga Diklat DPW PKB Jawa Timur, 1998-2000",
3307-00-0000-0201,"Initiator Forum LSM Jawa Timur, 1992-1993",
3307-00-0000-0201,"Wakil Sekretaris PW GP Ansor Jawa Timur, 1991 * 1996",
3307-00-0000-0201,"Koord. Diklat dan Pcngembangan Masyarakat BLPM Lokpesdam NU Indonesia Tengah di Surabaya, 1990-1997",
3307-00-0000-0201,"Ketua Kawula Muda Banyumasan di Surabaya, 1990 - 1995",
3307-00-0000-0201,"Sekretaris Korcab PMII Jawa Timur, 1987-1990",
3307-00-0000-0201,Wakil Sekretaris PW Lakpesdam NU Jawa Timur 1986 -1990,
3307-00-0000-0201,"Ketua Rayon PMII F Tarbiyah IAIN Surabaya, 1985-1986",
3307-00-0000-0601,Ketua Keluarga Pemuda Pelajar Mahasiswa Kebumen D I Yogyakarta,
3307-00-0000-0601,Pengurus Himpunan Mahasiswa lslam Yogyakarta,
3307-00-0000-0601,Keria Badan ierwakilan Mahasiswa Fakuhas Kehulanan Universitas Cadjah Mada,
3307-00-0000-0601,Ketua Keluarga Besar Kebumen Jawa Tengah di Medan,
3307-00-0000-0601,"Ketua Persatuan Sarjana Kehutanan Indonesia,Sumatera Utara",
3307-00-0000-0601,Pembina KORPRI Unit Kantor Wilayah Deparlemen Kehutanan SumatEra Utara,
3307-00-0000-0601,Ketua Umum lkatan Anggar Seluruh Indonesi4 Sumatera Utara,
3307-00-0000-0601,Pembina Paguyuban Pujakusuma Suamatera Utara,
3307-00-0000-0601,Ketua Umum PERBASI Pengurus Daerah Sumatera Utara,
3307-00-0000-0601,Pembina Persatuan Insinyur Indonesia Cabang Sumut,
3307-00-0000-0601,"Ketua Umum Alumni Universitas Gadjah Mada, Sumatera Utara",
3307-00-0000-0601,Ketua Ikatan Mahasiswa Magister Manajemen Universitas Sumatera Utara,
3307-00-0000-0601,Sekretaris Dewan Penyantun Universitas Sumatera utara,
3307-00-0000-0601,"Pembina Koperasi lkatan Alumni IPB, Sumatera Utara",
3307-00-0000-0601,Komisaris HPHTI Patungam PT. Sumatera Silva Lestari,
3307-00-0000-0601,Ketua Persatuan Orangtua Mahasiswa Kedokteran Universitas Sumatera Utara,
3307-00-0000-0601,Anggota Dewan Penyantun Institut Agama Islam Negeri (IAIN),
3307-00-0000-0601,Konsultan Koperasi Perumahan Wanabakti Nusantara Deoartemen Kehutanan,
3307-00-0000-0601,Ketua Koperasi Karyawan Departemen Kehutanan,
3307-00-0000-0601,Ketua Perkumpulan Kematian Karyawan Departemen Kehutanan,
3307-00-0000-0601,Ketua Alumni SMPN III Kebumen,
3307-00-0000-0601,Anggota Wali Amanat Universits Sumatera Utara,
3307-00-0000-0601,"Pengurus Alumni Universitas Sumatera Utara, Jakana",
3307-00-0000-0601,Pengurus KAGAMA Pusat,
3307-00-0000-0601,Pembina Alumni Fakultas Kehutanan Universitas Gadjah Mada,
3307-00-0000-0601,Ketua Alumni SMA Negori 6 Yogyakarta,
3307-00-0000-0601,Anggota Majelis Agung Warga Jawa Sumatera Utara,
3307-00-0000-0601,Ketua Dewan Perhimpunan Intelektual warga Jawa sumatera Utara,
3307-00-0000-0601,Komisaris Utama PT. Inhutan lll,
3307-00-0000-0601,Ketua Alumni Fakultas Kehutanan Universitas Gadjah Mada,
3307-00-0000-0601,Komisaris Perlarnina Ceothermal (PCE),
3307-00-0000-0601,Ketua lkatan Sarjana Nahdalul Ulama(ISNU),
3307-00-0000-0601,Tenaqa Harian Ditjen Kehutanan 0l-0l-l980,
3307-00-0000-0401,Ketua Umum PB Percasi (2004-2005),
3307-00-0000-0401,Wakil Ketua Umum PB Percasi (2005-2009),
3307-00-0000-0401,Wakil Ketua Umum PB Percasi (2010-2013),
3307-00-0000-0401,Ketua Badan Lige Catur Nasonal (2009-2013),
3307-00-0000-0401,Vice President Asean Chess Confederation (2007-2011),
3307-00-0000-0401,Grand Master Council of FIDE (1999-2003),
3307-00-0000-0401,Satu dari Lima Maha Guru Catur Dunia (Fide Senior Trainer),
3307-00-0000-0401,Ketua Komisi Sport & Environtment KOI (2007-209) (Mengundurkan diri karena menjabat di DPR RI Periode 2009-214),
3307-00-0000-0401,Ketua PORA Taruna Merah Putih Tingkat Nasional (Tahun 2008),
3307-00-0000-0401,Ketus Departemnen Hubungan Antar Lembaga PDI Perjuan (Tahun 2010-Sekarang),
3307-00-0000-0801,"DPP PAN,Jakarta,Sekretaris Jenderal, 2010-2015",
3307-00-0000-0801,"DPP PAN,Jakarta,Ketua, 2005 - 2010",
3307-00-0000-0801,"Senat Mahasiswa Fakultas Teknik Universitas Diponegoro,Semarang,Pengurus, -",
3307-00-0000-0801,"11m KKN Universitas Diponegoro .Kendal,Sekretaris Umum. -",
3307-00-0000-0801,"Keluarga Mahasiswa Teknik Kimia Universitas Diponegoro,Semarang,Sekretaris, -",
3307-00-0000-0801,"Majalah ""Reaktor"" Fakultas Teknik Universitas Diponcgoro,Semarang,Redaktur, -",
3307-00-0000-0801,"Resimen Mahasiswa ""Mahadipa""Universitas Diponegoro,Semarang,Aktivis Resimcn, -",
3307-00-0000-0801,"HMI Universitas Diponcgoro,Scmarang,Aktivis, -",
3307-00-0000-0801,"DPRt PAN Gajahmungkur,Semarang,Ketua, -",
3307-00-0000-0801,"DPC PAN Gajahmungkur,Semarang,Fungsionaris, -",
3308-00-0000-0501,2009 KETUA BIDANG ENERGI KADIN DAN ANGGOTA KADIN HUBUNGAN LUAR NEGRI DENGAN KOREA,
3308-00-0000-0502,2009 WAKIL BENDAHARA PARTAI GOLKAR,
3308-00-0000-0903,"Wakil Ketua DPW PPP Prov. Bengkuku, tahun 2013- Sekarang",
3308-00-0000-0903,"wakil Bendahara DPW PPP Prov. Bengkuku, tahun 2011-2013",
3308-00-0000-0903,"Wakil Ketua KADIN, Bidang Pariwisata dan Promosi Internasional Prov. Bengkuku, tahun 2011- Sekarang",
3308-00-0000-0903,"Wakil Ketua KADIN, Bidang Investasi dan Bisnis Prov. Bengkuku, tahun 2005-2011",
3308-00-0000-0903,"Wakil Ketua 1 PHRI Prov. Bengkuku, tahun 2011- Sekarang",
3308-00-0000-0903,"Ketua Koperasi Keluarga Besar Dewan Asuransi Indinesia Wilayah Bandung, tahun 2000-2002",
3308-00-0000-0903,"Ketua I Senat Mahasiswa UNSOED, tahun 1991-1992",
3308-00-0000-0903,"Ketua Badan Pengawas Koperasi Mahasiswa UNSOED, tahun 1990-1991",
3308-00-0000-0903,"Ketua Unit Kegiatan mahasiswa Beladiri Karate UNSOED, tahun 1989-1992",
3308-00-0000-0202,FALAYAT NU (KETUA PIMPINAN PUSAT 2012 S/D SEKARANG),
3308-00-0000-0202,FATAYAT NU (SEKRETARIS PIMPINAN PUSAT 2010-2012),
3308-00-0000-0202,FATAYAT NU (LITBANG PIMPINAN PUSAT 2005-2010),
3308-00-0000-0202,IPPPNU (KETUA PIMPINAN PUSAT 2000-2003),
3308-00-0000-0202,PMII CABANG PURWOKETO (KETUA KORP PMII 1994-1998),
3308-00-0000-0202,DPP HKPI (KETUA HIMPUNAN PERIKANAN INDONESIA 2011-2006),
3308-00-0000-0202,BPMF STAIN (1996-1998),
3308-00-0000-0202,PPI PURWOKERTO (BENDAHARA 1995-1998),
3308-00-0000-0202,ANGGOTA DIVISI PENGEMBANGAN POLITIK BMOIWI (2013-2018),
3308-00-0000-0601,GMNI (Cemkan Mahasiswa Nasional Indonesia),
3308-00-0000-0601,PVBSI,
3308-00-0000-0601,ATI,
3308-00-0000-0601,KNPI,
3308-00-0000-0702,"Ketua Lajnah Ta'lif Wa Nasr (Lembaga Penulisan dan Penerbitan) PBNU, Jakarta (2013-2015)",
3308-00-0000-0702,"Sekretaris Pusat Pengembangan Strategi dan Kebijakan DPP Partai Demokrat, Jakarta (2010-20 I 5)",
3308-00-0000-0702,"Ketua (Bidang Otonomi Daerah) DPP IMDI (Insan Muda Demokrat Indonesia), Jakarta 2010 - 2015",
3308-00-0000-0702,"Sekretaris Majelis Pembina Nasioanal PB PMII, Jakarta (2010-2013)",
3308-00-0000-0702,"Ketua Relawan SBY, Bidang Komunikasi Politik dan Ormas Islam, Jakarta (2009)",
3308-00-0000-0702,"Ketua Pimpinan Pusat Gerakan Pemuda Ansor, Jakarta (2005-2010)",
3308-00-0000-0702,"Wakil Sekretaris Jenderal DPP PKB (Dewan Pimpinan Pusat Partai Kebangkitan Bangsa), Jakarta (2000-2005)",
3308-00-0000-0702,"Anggota Badan Pekerja Forum Demokrasi (FORDEM), Jakarta (1998- 2000)",
3308-00-0000-0702,"Ketua PB PMII (Periode kedua), Jakarta (1997-2000)",
3308-00-0000-0702,"Pendiri dan Ketua Gerakan Perjuangan Anti Diskriminasi (GANDI), Jakarta (1998-2000)",
3308-00-0000-0702,"Mengikuti Pertemuan Ormas Keagamaan dan NGO di Tokyo, tahun 1998",
3308-00-0000-0702,"Mengikuti Pendidikan Advokasi dan Seminar Internasional tentang Gerakan Mahasiswa Indonesia dan Speaking Tour atas nama PB PMII di Belanda dan Jerman, selama 17 hari,tahun 1997",
3308-00-0000-0702,"Pendiri KontraS (Komite Untuk Orang Hilang dan Tindak Korban Kakerasan), Jakarta 1998",
3308-00-0000-0702,"Ketua Pengurus Besar Pergerakan Mahasiswa Islam Indonesia (PB PMII) Periode Pertama, Jakarta (1994-1997)",
3308-00-0000-0702,"Anggota Presidium Komite Independen Pemantau Pemilu (KIPP Nasional), Jakarta (1997)",
3308-00-0000-0702,"Sekretaris Forum Komunikasi Pers Mahasiswa se-Jabotabek (FKPMJ), Jakarta (1993-1995)",
3308-00-0000-0702,Pemimpin Redakasi Majalah Mahasiswa DIDAKTIKA IKIP Jakarta (1993-1994),
3308-00-0000-0702,"Lurah Pondok Pesantren Al-Hikmah, Benda, Bumiayu, Brebes, Jawa Tengah, tahun (1984-1985)",
3308-00-0000-0702,"Ketua Umum Himpunan Santri Banyumas (HISBAN) Konsulat Pesantren Al-Hikmah, tahun ( 1 983 - 1 984)",
3308-00-0000-0401,,
3308-00-0000-0404,,
3308-00-0000-0801,"BID. ADVOKASI DPD PAN KAB. CILACAP, KETUA, 2008-2013",
3308-00-0000-0801,"IKATAN P;EJABAT LELANG KELAS II INDONESIA, SEKRETARIS I, 2010-2013",
3308-00-0000-0801,"DEP. BAKAT & MINAT MAHASIAWA BEM FH UNDIP, MENTERI, 2002-2003",
3308-00-0000-0801,"BID. KOMUNIKASI UMAT HMI KOM. HUKUM UNDIP, ANGGOTA, 2001-2002",
3308-00-0000-0801,"MPL SMU NEGERI 1 CILACAP, BENDAHARA, 1997-1998",
3308-00-0000-0801,"OSIS SMP NEGERI 2 CILACAP, KETUA 2, 1995-1996",
3309-00-0000-0504,"2008-2012, DPD AMPI,KETUA,BREBES",
3309-00-0000-0504,"2010-2015,DPD GOLKAR, KETUA,BREBES",
3309-00-0000-0901,Ketua Umum PP IPNU 1988 - 1992,
3309-00-0000-0901,Ketua Umum PP IPNU 1992- 1996,
3309-00-0000-0201,,
3309-00-0000-0601,YAYASAN SOSIAL AL - IRSYAD CILACAP,
3309-00-0000-0601,(ANGGOTA DEWART DEMBIHA),
3309-00-0000-0301,,
3309-00-0000-0401,Badan Perwakilan Mahasiswa Fak. Kehutanan Universitas Gadjah Mada Yogyakarta (1980-1982,
3309-00-0000-0401,Badan Koordinasi Kemahasiswaan Universitas Gadjah Mada Yogyakarta,
3309-00-0000-0405,,
3309-00-0000-0801,"Asosiasi Badan Akuntabilitas Publik Regional Asia (ARAPAC),Bangkok,Wakil Ketua,",
3309-00-0000-0801,"Dewan Pakar ICMI, Bid. Pengembangan IPTEK,Jakarta,Sekretaris, 2010-2015",
3309-00-0000-0801,"DPP PAN,Jakarta,Wasekjend, 2004 - 2009",
3309-00-0000-0801,"RCTI Peduli,Jakarta,Direktur, 1998 - 2005",
3309-00-0000-0801,"Asosiasi Pascasarjana Komunikasi UI,Jakarta,Ketua Umum, 199",
3309-00-0000-0801,"Ikatan Jurnalis Televisi Indonesia (IJTI),Jakarta,Wasekjend. 2000 - 2001",
3309-00-0000-0801,"Forum Peminat Komunikasi (FORMASI),Jakarta,Presidium, 1994 - 1999",
3309-00-0000-0801,"Angkatan 24 IPB,Bogor,Sekretaris Mahasiswa, 1987 - 1999",
3309-00-0000-0801,"Forum Dialog Indonesia (FDI),Jakarta,Presidium, 1991 - 1994",
3309-00-0000-0801,"Koran kampus ""Gema Almamater IPB"",Bogor,Pemimpin Umum, 1989 - 1991",
3310-00-0000-0501,"2011-2016,DPP LEMKARI, KETUA, NASIONAL",
3310-00-0000-0501,"2012-2017, DPP KSPSI, DEWAN PAKAR DAN ADVOKASI, NASIONAL",
3310-00-0000-0501,"2012-2017, MPW PEMUDA PANCASIAL JAWA TENGAH, KETUA,JAWA TENGAH",
3310-00-0000-0501,"2009-2013, DPR RI ANGGOTA, JAKARTA",
3310-00-0000-0902,Ketua Lembaga Bantuan Hukum (LBH) DPP PPP (2011-sekarang),
3310-00-0000-0902,Ketua Bidang Hubungan Luar Negeri DPP IKADIN (Ikatan Advokat Indonesia) (2007 - 2013),
3310-00-0000-0902,"Ketua Bidang Non-Litigasi, Lembaga Penyluhan Dan Bantuan Hukum PBNU (2005 -2010)",
3310-00-0000-0902,Ketua Umum (Chairman) Indonesian Corporate Counsel Association (ICCA) (2006 - 2008),
3310-00-0000-0902,Ketua Badan Pengawas Yajasan Asrama & Pendidikan Islam (YAPI) Al Azhar Rawamangun (2005-2007),
3310-00-0000-0902,"Wakil Ketua Bidang Pengabdian Masyarakat, Ikatan Alumni UI (ILUNI) FH-UI (2004-2009)",
3310-00-0000-0201,1992: Anggota Dewan Eksekutif Walisongo English Club.,
3310-00-0000-0201,1993: Ketua Solidaritas Mahasiswa Salatiga.,
3310-00-0000-0201,"1993: Dewan Eksekutif, Teater Mahasiswa IAIN.",
3310-00-0000-0201,"1994: Pemimpin Redaksi, Majalah Mahasiswa IAIN",
3310-00-0000-0201,1994: Ketua Badan Perwakilan Mahasiswa IAIN Salatiga.,
3310-00-0000-0201,1991-1992: Ketua Komisariat PMII IAIN Salatiga,
3310-00-0000-0201,1994 -1995: Ketua Pengurus Cabang Pergerakan Mahasiswa Islam Indonesia (PC PMII) Salatiga.,
3310-00-0000-0201,"1995 - 1996: Anggota Pleno, Koordinator Cabang Pergerakan Mahasiswa Islam Indonesia (PKC PMII) Jawa Tengah",
3310-00-0000-0201,"1997 - 2000: Ketua Lembaga Studi dan Advokasi Buruh (LSAB), Pengurus Besar Pergerakan Mahasiswa Islam Indonesia (PB PMII)",
3310-00-0000-0201,2000: Calon Ketua Umum Pengurus Besar Pergerakan Mahasiswa Islam Indonesia (PB PMII),
3310-00-0000-0201,"1996: Direktur Eksekutif, Jaringan Studi Transformasi Sosial (JSTS), Salatiga.",
3310-00-0000-0201,"1996: Komite Pengarah, Nadwah Dirasah Islam dan Kemasyarakatan (NADIKA, Lembaga Studi Islam dan Masyarakat), Jawa Tengah.",
3310-00-0000-0201,"1997: Pendiri dan Anggota Eksekutif Regional, Wahana Lingkungan Hidup (WALHI), Jawa Tengah.",
3310-00-0000-0201,"1998; Anggota Pleno, Anggota pleno Forum Silarurrahmi Ulama Jawa Tengah dan DI. Yogyakarta (FSU JT-DIY)",
3310-00-0000-0201,"1999: Acting Direktur, Insitute for Social Institutions Studies (ISIS), Jakarta.",
3310-00-0000-0201,"1999: Pendiri Komite Anti Diskriminasi Indonesia (KADI), Jakarta,",
3310-00-0000-0201,"2002: Pendiri dan Anggota Komite Eksekutif, Monopoli Watch, Jakarta.",
3310-00-0000-0204,"1986-1989,KETUA PMII, PEKALONGAN",
3310-00-0000-0204,"1989-1994, WK. SEKRETARIS PC NU, PEKALONGAN",
3310-00-0000-0204,"1994-1999, BENDAHARA PC, PEKALONGAN",
3310-00-0000-0204,"1999-2018, KETUA DPC PKB, PEKALONGAN",
3310-00-0000-0601,Korkom GMNI Univ Jayabaya (1977-1978),
3310-00-0000-0601,Ketua GMNI DKI Jakarta (1979-1981),
3310-00-0000-0601,Anggota Aperdia Hankam.,
3310-00-0000-0601,PDI / PDI Perjuangan s/d thn 2009.,
3310-00-0000-0601,Kader Partai GERINDRA ( sejak Agustus 2012),
3310-00-0000-0401,"GMKI, SALATIGA (1970-7983)",
3310-00-0000-0401,"UNESCO CLUB, SALATIOA(1980-1985)",
3310-00-0000-0401,IKATAW SAeJANA EICONOMI IWDONESIA(Ise (1906-SeKA RA WE),
3310-00-0000-0401,KEMI DEWAN PAKAL PSMTI-PUSAT,
3310-00-0000-0401,"ANGGOTA DEWAN RISET WASIGWAL /DRN, 1999-2005",
3310-00-0000-0805,"Keluarga Besar Haji Hasan Ashari,Pemalang,Ketua Umum, 2011 - Now",
3310-00-0000-0805,"Pandu Indonesia,Jakarta,Wakil Bendahara Umum, 2012-Now",
3310-00-0000-0805,"GAPENSI (Gabungan Pengusaha Konstruksi Indonesia),Pemalang,Anggota, 2011 - Now",
3310-00-0000-0805,"ADAPI (Asosiasi Distributor Aspal Pertamina Indonesia),Jakarta,Anggota, 2012- Now",
3310-00-0000-0805,"Asosiasi Distributor Semen HOLCIM,Jakarta,Anggota, 2011 - Now",
3310-00-0000-0805,"IMPP (Ikatan Mahasiswa, Pemuda & Pelajar Pemalang) di Surabaya, Surabaya,Ketua",
3401-00-0000-0501,"2005-2015, PT SURYA CITRA MEDIA, KOMISARIS, JAKARTA",
3401-00-0000-0501,"1994-2014, PT MEKAR UNGGUL SARI, DIREKTUR, JAKARTA",
3401-00-0000-0501,"1995-1998, PT BURSA EFEK JAKARTA, KOMISARIS,",
3401-00-0000-0201,,
3401-00-0000-0604,FKPPI YOGYAKARTA,
3401-00-0000-0604,SAR YOGYAKARTA,
3401-00-0000-0604,PAGUYUBAN BECAK YOGYAKARTA,
3401-00-0000-0604,GERAKAN PEMUDA KULON PROGO,
3401-00-0000-0301,Ketua MPW PKS DIY,
3401-00-0000-0301,Ketua DPW PKS DIY,
3401-00-0000-0704,KETUA OSIS SMPN I SURABYA,
3401-00-0000-0704,KETUA OSIS SMA BOPKRI I SURABAYA,
3401-00-0000-0704,KETUA BIDANG ORGANISASI VII,
3401-00-0000-0704,BIDANG BUDAYA VII YOYAKARTA,
3401-00-0000-0704,KETUA ASMINDO KOMDA YOGYAKAR 1997 - 2006,
3401-00-0000-0704,ASMINDO PUSAT 2008 - SEKARANG,
3401-00-0000-0704,ASEAN FURNITURE INDUSTRIES COUNAL (AFIC),
3401-00-0000-0704,PENASEHAT KKADIN TIMUR TENGAH,
3401-00-0000-0401,,
3401-00-0000-0403,DPC PDI Perjuangan Pendamping Sleman Th. 1998-1999,
3401-00-0000-0403,DPD PDI Perjuangan DIY Th. 2000-2005,
3401-00-0000-0403,DPC PDI Perjuangan Sleman Th. 2005-2010,
3401-00-0000-0403,DPD PDI Perjuangan DIY Th. 2010-2015,
3401-00-0000-0801,"Pusat Pengkajian Strategi Dan Kebijakan, YK,Yogyakarta,Direktur Eksekutif",
3401-00-0000-0801,"Institute Of Internasional Studies, Fisipol, UGM,Yogyakarta.Direktur Eksekutif, 2009 -",
3401-00-0000-0801,"Majlis Pendidikan Kader PP Muhammadiyah,Jakarta,Ketua, 2010 - sekarang",
3401-00-0000-0801,"Asosiasi Ekonomi Politik Indonesia,Jakarta,Ketua",
3401-00-0000-0801,"Komunitas Indonesia Baru (KIBAR).Jakarta,Wali Amanat, 2004 - sekarang",
3401-00-0000-0801,"MPB DPP BM PAN,Jakarta,Anggota, 2011 - sekarang",
3401-00-0000-0801,"MPP DPW PAN, Yogyakarta,Anggota, 2010 - sekarang",
3501-00-0000-0505,"2004-2009, PARTAI GOLKER, WAKIL KETUA BINDANG PEMUDA, SURABAYA",
3501-00-0000-0505,"2009-2015, PARTAI GOLKER, KETUA B DPD, SURABAYA",
3501-00-0000-0505,"2012-2017, ORMAS MKGR, SEKRETARIS DPD, JAWA TIMUR",
3501-00-0000-0201,Senat Mahasiswa Fakultas Tarbiyah IAIN Sunan Ampel Surabaya 1994-1995 Surabaya 1994-1995,
3501-00-0000-0201,Ketua Umum PMII Cabang Surabaya 1995 - 1996,
3501-00-0000-0201,Ketua Umum PMII Koordinator Cabang Jawa Timur 1996- 1998,
3501-00-0000-0201,Ketua Umum Dewan Koordinasi Wilayah Garda Bangsa Jawa Timur 2002-2004,
3501-00-0000-0201,Ketua Umum Dewan Koordinasi Nasional Garda Bangsa 2004 - 2006,
3501-00-0000-0201,Ketua DPW PKB Jawa Timur 2005 - 2010,
3501-00-0000-0201,Sekrelaris Jenderal DPP PKB 2010 - sekarang,
3501-00-0000-0202,,
3501-00-0000-0602,Ketua DPD Gapasdap Jawa Timur (1997-2010),
3501-00-0000-0602,Wakil Ketua Umum DPP Gapasdap Pusat (1998-2003),
3501-00-0000-0602,Wakil Ketua Bidang Angkutan Penumpang dan Roro DPP INSA (2003-2008),
3501-00-0000-0602,Ketua Bidang Usaha & Tarif DPP Gapasdap Pusat (2003-2008),
3501-00-0000-0602,"Bendahara Masyarakat Transportasi Indonesia (MTl), (2005-2010)",
3501-00-0000-0602,Ketua lkatan Alumni Fakultas Teknologi Kelautan Komisariat Pusat lnstitut Teknologi 10 November Surabaya (2007-sekarang),
