id,question,answer,reference_law,excerpt_law
077,Apakah Peraturan yang diterapkan untuk Partai lokal Aceh sama dengan Partai Nasional?,"Beda, karena partai Aceh mengikuti aturan UU no. 11 Tahun 2006 tentang partai politik dan diatur lebih rinci di Qanun no. 3 Tahun 2008 sedangkan partai nasional mengikuti aturan UU no. 2 Tahun 2011. Akan tetapi, Partai Aceh tetap mengikuti aturan yang tertera dalam UUD 1945, Undang - Undang tentang pemilu selama tidak ada aturan khusus yang mengatur mengenai Pemerintahan Aceh.","UU no. 8 Tahun 2012 Pasal 322, UU no. 11 Tahun 2006, UU no 2 Tahun 2011","Keikutsertaan partai politik lokal di Aceh dalam Pemilu anggota DPRD provinsi dan DPRD kabupaten/kota sepanjang tidak diatur khusus dalam Undang-Undang yang mengatur mengenai Pemerintahan Aceh, berlaku ketentuan Undang Undang ini."
078,Kenapa ada Perbedaan antara Partai Aceh dan Partai Nasional?,Pembentukan Partai Lokal Aceh diberikan hak khusus sesuai UU No. 11 Tahun 2006 untuk meningkatkan partisipasi politik dan aspirasi masyarakat Aceh secara Konstitusional.,"UU no. 11 Tahun 2006 Pasal 1 Ayat 14, Pasal 75 Ayat 1,2,3,4,5,6,7,8, Pasal 77 Ayat 1 Huruf (a), (b), (c). Ayat 2 Huruf (a), (b), Ayat 3, dan Pasal 79",
079,Kenapa Partai Lokal Aceh tidak memiliki kursi di DPR?,Partai Lokal Aceh hanya berhak mengikuti pemilu untuk memilih anggota DPRK/DPRA,UU no. 11 Tahun 2006 Pasal 80 Ayat 1 dan 2,
080,Apa Manfaat dan Pentingnya Pemilu?,Pemilu merupakan wadah yang sangat penting dalam meyuarakan aspirasi masyarakat untuk memilih pemimpin yang sesuai dengan amanat UUD 1945,Pembukaan UU no. 8 Tahun 2012 Huruf (a),"Pemilihan umum sebagai sarana perwujudan kedaulatan rakyat untuk menghasilkan wakil rakyat yang aspiratif, berkualitas, dan bertanggung jawab berdasarkan Pancasila dan Undang-Undang Dasar Negara Republik Indonesia Tahun 1945"
081,Bagaimana cara mengetahui Track Record Caleg?,"Dikutip dari Komik Pemilih Pemula GEPAK : Masyarakat dapat mencari tahu tentang track record caleg yang di inginkan melalui media cetak, online maupun elektronik dan KPU menyedikan informasi yang cukup untuk hal tersebut melalui link ini : http://dct.kpu.go.id/",Tidak ada aturan tentang ini,Tidak ada aturan tentang ini
082,Siapa Pengawas Pemilu?,"Lembaga yang mengawasi penyelenggaraan Pemilu adalah Badan Pengawasan Pemilu atau Bawaslu. Bawaslu membawahi Bawaslu Provinsi yang bertugas mengawasi penyelenggaraan pemilu di wilayah provinsi, Panwaslu Kabupaten/Kota yang mengawasi wilayah Kabupaten/Kota, Panwaslu Kecamatan yang mengawasi wilayah kecamatan dan PPL atau Pengawas Pemilu Lapangan yang ditempat disetiap desa atau kelurahan, serta PPLN atau pengawas pemilu luar negeri yang mengawasi pemilu diluar negeri.","UU no. 11 Tahun 2011 Pasal 1 Ayat 16, 17, 18, 19, 20, dan 21.","Pasal 1, 16. Badan Pengawas Pemilu, selanjutnya disingkat Bawaslu, adalah lembaga penyelenggara Pemilu yang bertugas mengawasi penyelenggaraan Pemilu di seluruh wilayah Negara Kesatuan Republik Indonesia. 17. Badan Pengawas Pemilu Provinsi, selanjutnya disingkat\nBawaslu Provinsi, adalah badan yang dibentuk oleh Bawaslu yang bertugas mengawasi penyelenggaraan Pemilu di wilayah provinsi. 18. Panitia Pengawas Pemilu Kabupaten/Kota, selanjutnya disingkat Panwaslu Kabupaten/Kota, adalah panitia yang dibentuk oleh Bawaslu Provinsi yang bertugas mengawasi penyelenggaraan Pemilu di wilayah kabupaten/kota. 19. Panitia Pengawas Pemilu Kecamatan, selanjutnya disingkat Panwaslu Kecamatan, adalah panitia yang dibentuk oleh Panwaslu Kabupaten/Kota yang bertugas mengawasi penyelenggaraan Pemilu di wilayah kecamatan atau nama\nlain. 20. Pengawas Pemilu Lapangan adalah petugas yang dibentuk oleh Panwaslu Kecamatan yang bertugas mengawasi penyelenggaraan Pemilu di desa atau nama lain/kelurahan. 21. Pengawas Pemilu Luar Negeri adalah petugas yang dibentuk oleh Bawaslu yang bertugas mengawasi penyelenggaraan Pemilu di luar negeri."
083,Apa Peran Pengawas Pemilu?,Bawaslu bertugas mengawasi penyelenggaraan Pemilu dalam rangka pencegahan dan penindakan pelanggaran untuk terwujudnya Pemilu yang demokratis.,UU no. 11 Tahun 2011 Pasal 73-84,
084,Apa sanksi yang diberikan Panwaslu terkait pelanggaran dalam pemilu?,Setiap pelanggaran dalam pemilu yang ditemukan Panwaslu akan dikenakan sanksi baik berupa pidana kurungan dalam penjara maupun denda dengan membayarkan sejumlah uang yang telah diatur dalam UU no. 8 Tahun 2012,UU no. 8 Tahun 2012 Pasal 273-291,
085,Bisakah warga negara Indonesia yang mengaku sebagai Gay/Lesbian/Transgender/Bisexual memiliki hak untuk memilih?,"Di Indonesia, tidak ada regulasi yang menyatakan tentang seseorang itu Gay, Lesbi, Biseksual ataupun Transgender dalam Pemilu. Namun Negara Kesatuan Republik Indonesia menjunjung tinggi Hak Asasi Manusia terutama dalam memilih, oleh karena itu pemerintah melalui KPU memberlakukan persyaratan pemilih ialah Warga Negara Indonesia baik laki-laki maupun perempuan sesuai dengan KTP/KK/Paspor yang tertera.","UU No. 8 Tahun 2012 Pasal 149 Ayat 1 Huruf (a), (b), (c), Ayat 2, 3, dan Pasal 150 Ayat 1, 2 Huruf (a), (b), (c) Ayat 3 Huruf (a), (b), (c)","Pasal 149 (1) Pemilih yang berhak mengikuti pemungutan suara di TPS meliputi: a. Pemilih yang terdaftar pada daftar pemilih tetap di TPS yang bersangkutan; b. Pemilih yang terdaftar pada daftar pemilih tambahan; dan c. Pemilih yang tidak terdaftar pada daftar pemilih tetap dan daftar pemilih tambahan. (2) Pemilih sebagaimana dimaksud pada ayat (1) huruf b dapat menggunakan haknya untuk memilih di TPS lain/TPSLN dengan menunjukkan surat pemberitahuan dari PPS untuk memberikan suara di TPS lain/TPSLN. (3) Dalam hal pada suatu TPS terdapat Pemilih sebagaimana dimaksud pada ayat (1) huruf b, KPPS pada TPS tersebut mencatat dan melaporkan kepada KPU Kabupaten/Kota melalui PPK. Pasal 150 (1) Pemilih yang tidak terdaftar pada daftar pemilih tetap atau daftar pemilih tambahan sebagaimana dimaksud dalam Pasal 149 ayat (1) huruf c dapat menggunakan kartu tanda penduduk atau paspor. (2) Untuk Pemilih yang menggunakan kartu tanda penduduk atau paspor sebagaimana dimaksud pada ayat (1) diberlakukan ketentuan: a. memilih di TPS yang ada di RT/RW atau nama lain sesuai dengan alamat yang tertera di dalam KTP atau paspornya; b. terlebih dahulu mendaftarkan diri pada KPPS setempat; dan c. dilakukan 1 (satu) jam sebelum selesainya pemungutan suara di TPS setempat. (3) Untuk Pemilih yang menggunakan paspor dengan alamat di luar negeri, diberlakukan ketentuan: a. lebih dahulu mendaftarkan diri pada KPPS setempat; dan b. dilakukan 1 (satu) jam sebelum selesainya pemungutan suara di TPS setempat."
086,Bolehkah LGBT mencalonkan diri sebagai calon legislatif?,"Namun, dalam pernyataan seorang anggota KPU, LGBT dibolehkan menjadi caleg pada pemilu 2014 dengan ketentuan dan persetujuan partai. Berikut sumber beritanya : http://www.portalkbr.com/berita/nasional/2611869_4202.html",Tidak ada aturan yang membahas tentang ini,Tidak ada aturan yang membahas tentang ini
