id,description,anggota_id
339,"Diduga terlibat kasus pelanggaran politik uang terkait membagikan amplop berisi uang Rp 50 ribu kepada warga yang berangkat ke tempat pemungutan suara (TPS) di Dusun Kulonkali, Desa Kemiri, Kecamatan Jabung, Kabupaten Malang.",235
340,Diduga melakukan pelanggaran terkait dugaan pelanggar kampanye menggunakan rumah ibadah.,236
341,Pernah melakukan pelanggaran Etik dan di pecat oleh anggota BK DPR karena tidak kooperatif dengan BK DPR yang sudah tiga kali memanggilnya dalam kasus dugaan korupsi.,237
342,Diduga terlibat kasus pelanggaran terkait dugaan penggelembungan yang terjadi pada Pileg 2014,238
343,Pernah menjadi pengacara terdakwa kasus dugaan korupsi pengadaan driving simulator uji klinik pengemudi roda dua (R2) dan roda empat (R4) tahun anggaran 2011 di Korlantas Polri.,238
344,Diduga terlibat kasus korupsi terkait kasus penyelewengan dana Program Penanganan Sosial Ekonomi Masyarakat (P2SEM) di Bojonegoro saat menjabat Anggota DPD Jawa Timur periode 2004-2009,239
345,Difuga terlibat pelanggaran terkait kasus pemasangan alat peraga kampanye (APK) di pohon pada Pileg 2014,240
346,"Pernah diperiksa KPK terkait kasus dugaan ketidakwajaran renovasi ruang Badan Anggaran (Banggar) DPR RI senilai Rp20,3 miliar.",241
347,Diduga terlibat kasus korupsi terkait penerimaan Brigadir Polisi dan Calon Siswa Sekolah Inspektur Polisi Sumber Sarjana (SIPSS) TA 2013.,241
348,"Pernah diperiksa Polisi terkait Kasus dugaan pemalsuan surat keputusan MK terkait kursi legislatif Dewie Yasin Limpo, pada 14 Agustus 2009",242
